{
  "address": "0x231cc0dbbcffc4b7",
  "contractName": "ceUSDT",
  "path": {
    "vault": "/storage/ceUSDTVault",
    "balance": "/public/ceUSDTBalance",
    "receiver": "/public/ceUSDTReceiver"
  },
  "symbol": "ceUSDT",
  "name": "Tether USD (Celer)",
  "decimals": 8,
  "logoURI": "https://cdn.jsdelivr.net/gh/FlowFans/flow-token-list@main/token-registry/A.231cc0dbbcffc4b7.ceUSDT/logo.png",
  "tags": ["wrapped-celer"],
  "extensions": { "coingeckoId": "tether", "website": "https://tether.to/" }
}
