{
  "address": "0x231cc0dbbcffc4b7",
  "contractName": "ceBUSD",
  "path": {
    "vault": "/storage/ceBUSDVault",
    "balance": "/public/ceBUSDBalance",
    "receiver": "/public/ceBUSDReceiver"
  },
  "symbol": "ceBUSD",
  "name": "Binance USD (Celer)",
  "decimals": 8,
  "logoURI": "https://cdn.jsdelivr.net/gh/FlowFans/flow-token-list@main/token-registry/A.0x231cc0dbbcffc4b7.ceBUSD/logo.png",
  "tags": ["wrapped-celer"],
  "extensions": {
    "address": "0xe9e7cea3dedca5984780bafc599bd69add087d56",
    "assetContract": "https://bscscan.com/address/0xe9e7cea3dedca5984780bafc599bd69add087d56",
    "coingeckoId": "binance-usd"
  }
}
