{
  "address": "0xd6f80565193ad727",
  "contractName": "stFlowToken",
  "path": {
    "vault": "/storage/stFlowTokenVault",
    "balance": "/public/stFlowTokenBalance",
    "receiver": "/public/stFlowTokenReceiver"
  },
  "symbol": "stFlow",
  "name": "Liquid Staked Flow",
  "decimals": 8,
  "logoURI": "https://cdn.jsdelivr.net/gh/FlowFans/flow-token-list@main/token-registry/A.d6f80565193ad727.stFlowToken/logo.svg",
  "tags": ["utility-token"],
  "extensions": {
    "website": "https://app.increment.fi/staking",
    "twitter": "https://twitter.com/incrementfi",
    "discord": "https://discord.gg/r2keKxuKqX"
  }
}
