{
  "address": "0x231cc0dbbcffc4b7",
  "contractName": "ceWETH",
  "path": {
    "vault": "/storage/ceWETHVault",
    "balance": "/public/ceWETHBalance",
    "receiver": "/public/ceWETHReceiver"
  },
  "symbol": "ceWETH",
  "name": "Wrapped Ether (Celer)",
  "decimals": 8,
  "logoURI": "https://cdn.jsdelivr.net/gh/FlowFans/flow-token-list@main/token-registry/A.231cc0dbbcffc4b7.ceWETH/logo.png",
  "tags": ["wrapped-celer"],
  "extensions": { "coingeckoId": "weth" }
}
