{
  "address": "0x231cc0dbbcffc4b7",
  "contractName": "ceBNB",
  "path": {
    "vault": "/storage/ceBNBVault",
    "balance": "/public/ceBNBBalance",
    "receiver": "/public/ceBNBReceiver"
  },
  "symbol": "ceBNB",
  "name": "Binance Coin (Celer)",
  "decimals": 8,
  "logoURI": "https://cdn.jsdelivr.net/gh/FlowFans/flow-token-list@main/token-registry/A.0x231cc0dbbcffc4b7.ceBNB/logo.png",
  "tags": ["wrapped-celer"],
  "extensions": {
    "address": "0xbb4cdb9cbd36b01bd1cbaebf2de08d9173bc095c",
    "assetContract": "https://bscscan.com/address/0xbb4cdb9cbd36b01bd1cbaebf2de08d9173bc095c",
    "coingeckoId": "binancecoin"
  }
}
