{
  "address": "0x88b469471cfe5535",
  "contractName": "LBJDAO",
  "path": {
    "vault": "/storage/LBJDAOVault",
    "balance": "/public/LBJDAOMetadata",
    "receiver": "/public/LBJDAOReceiver"
  },
  "symbol": "LBJ",
  "name": "LBJ DAO",
  "decimals": 8,
  "logoURI": "https://cdn.jsdelivr.net/gh/FlowFans/flow-token-list@main/token-registry/A.88b469471cfe5535.LBJDAO/logo.png",
  "tags": [
    "utility-token"
  ],
  "extensions": {}
}
