{
  "address": "0xe223d8a629e49c68",
  "contractName": "FUSD",
  "path": {
    "vault": "/storage/fusdVault",
    "balance": "/public/fusdBalance",
    "receiver": "/public/fusdReceiver"
  },
  "symbol": "FUSD",
  "name": "Flow USD",
  "decimals": 8,
  "logoURI": "https://cdn.jsdelivr.net/gh/FlowFans/flow-token-list@main/token-registry/FUSD/logo.svg",
  "tags": ["stablecoin"],
  "extensions": {
    "website": "https://docs.onflow.org/fusd/"
  }
}
