{
  "address": "0x7bf07d719dcb8480",
  "contractName": "brasil",
  "path": {
    "vault": "/storage/brasilVault",
    "balance": "/public/brasilMetadata",
    "receiver": "/public/brasilReceiver"
  },
  "symbol": "BR",
  "name": "brasil",
  "decimals": 8,
  "logoURI": "https://cdn.jsdelivr.net/gh/FlowFans/flow-token-list@main/token-registry/A.7bf07d719dcb8480.brasil/logo.png",
  "tags": ["utility-token"],
  "extensions": {
    "website": "https://toucans.ecdao.org/p/brasil",
    "twitter": "https://twitter.com/flowbrasilchain",
    "discord": "https://discord.gg/hT8EpC5mUN"
  }
}
