{
  "address": "0x231cc0dbbcffc4b7",
  "contractName": "ceMATIC",
  "path": {
    "vault": "/storage/ceMATICVault",
    "balance": "/public/ceMATICBalance",
    "receiver": "/public/ceMATICReceiver"
  },
  "symbol": "ceMATIC",
  "name": "Matic Token (Celer)",
  "decimals": 8,
  "logoURI": "https://cdn.jsdelivr.net/gh/FlowFans/flow-token-list@main/token-registry/A.0x231cc0dbbcffc4b7.ceMATIC/logo.png",
  "tags": ["wrapped-celer"],
  "extensions": { "coingeckoId": "matic-network" }
}
