{
  "address": "0xcfdd90d4a00f7b5b",
  "contractName": "TeleportedTetherToken",
  "path": {
    "vault": "/storage/teleportedTetherTokenVault",
    "balance": "/public/teleportedTetherTokenBalance",
    "receiver": "/public/teleportedTetherTokenReceiver"
  },
  "symbol": "tUSDT",
  "name": "Teleported Tether Token",
  "decimals": 8,
  "logoURI": "https://cdn.jsdelivr.net/gh/FlowFans/flow-token-list@main/token-registry/A.cfdd90d4a00f7b5b.TeleportedTetherToken/logo.png",
  "tags": ["teleported-token", "stablecoin"],
  "extensions": { "website": "https://blocto.app/" }
}
