{
  "address": "0x475755d2c9dccc3a",
  "contractName": "TeleportedSportiumToken",
  "path": {
    "vault": "/storage/TeleportedSportiumTokenVault",
    "balance": "/public/TeleportedSportiumTokenBalance",
    "receiver": "/public/TeleportedSportiumTokenReceiver"
  },
  "symbol": "SPRT",
  "name": "Teleported Sportium Token",
  "decimals": 8,
  "logoURI": "https://cdn.jsdelivr.net/gh/FlowFans/flow-token-list@main/token-registry/A.475755d2c9dccc3a.TeleportedSportiumToken/logo.png",
  "tags": ["teleported-token"],
  "extensions": { "coingeckoId": "sportium" }
}
