{
  "address": "0x0f9df91c9121c460",
  "contractName": "BloctoToken",
  "path": {
    "vault": "/storage/bloctoTokenVault",
    "balance": "/public/bloctoTokenBalance",
    "receiver": "/public/bloctoTokenReceiver"
  },
  "symbol": "BLT",
  "name": "Blocto Token",
  "decimals": 8,
  "logoURI": "https://cdn.jsdelivr.net/gh/FlowFans/flow-token-list@main/token-registry/A.0x0f9df91c9121c460.BloctoToken/logo.png",
  "tags": ["utility-token"],
  "extensions": {
    "website": "https://blocto.app/",
    "coingeckoId": "blocto-token"
  }
}
