{
    "address": "0x8259c73e487422d7",
    "contractName": "TheWolfofFlow",
    "path": {
        "vault": "/storage/TheWolfofFlowVault",
        "balance": "/public/TheWolfofFlowMetadata",
        "receiver": "/public/TheWolfofFlowReceiver"
    },
    "symbol": "WOLF",
    "name": "The Wolf of Flow",
    "decimals": 8,
    "logoURI": "https://cdn.jsdelivr.net/gh/FlowFans/flow-token-list@main/token-registry/A.8259c73e487422d7.TheWolfofFlow/logo.png",
    "tags": [
        "utility-token"
    ],
    "extensions": {}
}