{
  "address": "0x231cc0dbbcffc4b7",
  "contractName": "ceDAI",
  "path": {
    "vault": "/storage/ceDAIVault",
    "balance": "/public/ceDAIBalance",
    "receiver": "/public/ceDAIReceiver"
  },
  "symbol": "ceDAI",
  "name": "Dai Stablecoin (Celer)",
  "decimals": 8,
  "logoURI": "https://cdn.jsdelivr.net/gh/FlowFans/flow-token-list@main/token-registry/A.231cc0dbbcffc4b7.ceDAI/logo.png",
  "tags": ["wrapped-celer"],
  "extensions": {
    "address": "0x6b175474e89094c44da98b954eedeac495271d0f",
    "assetContract": "https://etherscan.io/address/0x6b175474e89094c44da98b954eedeac495271d0f",
    "coingeckoId": "dai"
  }
}
