{
    "address": "0xe39082fc08c1cd13",
    "contractName": "THEBEARDAO",
    "path": {
        "vault": "/storage/THEBEARDAOVault",
        "balance": "/public/THEBEARDAOMetadata",
        "receiver": "/public/THEBEARDAOReceiver"
    },
    "symbol": "BEAR",
    "name": "THE BEAR DAO",
    "decimals": 8,
    "logoURI": "https://cdn.jsdelivr.net/gh/FlowFans/flow-token-list@main/token-registry/A.e39082fc08c1cd13.THEBEARDAO/logo.png",
    "tags": [
        "utility-token"
    ],
    "extensions": {}
}